{"dataset_status":"demo","issues":[{"count":1,"description":"DEMO issue: one demo player has no recorded statistics.","rule_id":"DEMO-001","severity":"info"},{"count":1,"description":"DEMO issue: one demo match has no recorded score.","rule_id":"DEMO-002","severity":"warning"}],"limitations":["DEMO: this release is synthetic and exists only to test the interface."],"quarantined_rows":0,"sources":[{"label":"DEMO fixture generator","note":"DEMO data: synthetic values for interface testing only; not AFL statistics.","url":null}],"table_counts":{"matches":13,"player_games":264,"players":66}}
